<AJedan xmlns:xsi="http://www.w3.org/2001/XMLSchema-instance" xsi:noNamespaceSchemaLocation="file:/C:/Users/User/Desktop/a_jedan/a_jedan/src/main/resources/AJedan.xsd">
    <Jedan>
        <Podnosilac>
            <Ime>Ime0</Ime>
            <Prezime>Prezime0</Prezime>
            <Adresa>
                <Grad>Grad0</Grad>
                <Ulica>Ulica0</Ulica>
                <Broj>Broj0</Broj>
            </Adresa>
            <Drzavljanstvo>Drzavljanstvo0</Drzavljanstvo>
        </Podnosilac>
        <Telefonski_Broj>Telefonski_Broj0</Telefonski_Broj>
        <email>email0</email>
    </Jedan>
    <Dva/>
    <Tri/>
    <Cetiri>
        <Naslov>Naslov0</Naslov>
        <Alternativni_Naslov>Alternativni_Naslov0</Alternativni_Naslov>
    </Cetiri>
    <Pet>
        <Autorsko_Delo_Prerade>
            <Podaci_O_Originalnom_Autorskom_Delu>Podaci_O_Originalnom_Autorskom_Delu0</Podaci_O_Originalnom_Autorskom_Delu>
            <Ime_Autora>Ime_Autora0</Ime_Autora>
        </Autorsko_Delo_Prerade>
    </Pet>
    <Sest>
        <Podaci_O_Vrsti_Autorskog_Dela>Podaci_O_Vrsti_Autorskog_Dela0</Podaci_O_Vrsti_Autorskog_Dela>
    </Sest>
    <Sedam>
        <Podaci_O_Formi_Autorskog_Zapisa_Dela>Podaci_O_Formi_Autorskog_Zapisa_Dela0</Podaci_O_Formi_Autorskog_Zapisa_Dela>
    </Sedam>
    <Osam/>
    <Devet>
        <Da_Li_Je_Autorsko_Delo_Stvoreno_U_Radnom_Odnosu>Da_Li_Je_Autorsko_Delo_Stvoreno_U_Radnom_Odnosu0</Da_Li_Je_Autorsko_Delo_Stvoreno_U_Radnom_Odnosu>
    </Devet>
    <Deset>
        <Nameravani_Nacin_Koriscenja_Autorskog_Dela>Nameravani_Nacin_Koriscenja_Autorskog_Dela0</Nameravani_Nacin_Koriscenja_Autorskog_Dela>
    </Deset>
    <Jedanaest>
        <Potpis>Potpis0</Potpis>
    </Jedanaest>
    <Dvanaest>
        <Prilozi_Uz_Zahtev>Prilozi_Uz_Zahtev0</Prilozi_Uz_Zahtev>
    </Dvanaest>
    <Opis_Autorskog_Dela>Opis_Autorskog_Dela0</Opis_Autorskog_Dela>
    <Broj_Prijace>Broj_Prijace0</Broj_Prijace>
    <Datum_Podnosenja>Datum_Podnosenja0</Datum_Podnosenja>
</AJedan>